season,id,name,short_name,description,home_team,away_team,toss_won,decision,1st_inning_score,2nd_inning_score,home_score,away_score,winner,result,start_date,end_date,venue_id,venue_name,home_captain,away_captain,pom,points,super_over,home_overs,home_runs,home_wickets,home_boundaries,away_overs,away_runs,away_wickets,away_boundaries,highlights,home_key_batsman,home_key_bowler,home_playx1,away_playx1,away_key_batsman,away_key_bowler,match_days,umpire1,umpire2,tv_umpire,referee,reserve_umpire
2022,1304067,Sunrisers Hyderabad v Gujarat Titans,SRH v GT,"21st Match (N), Indian Premier League at Navi Mumbai, Apr 11 2022",SRH,GT,SRH,BOWL FIRST,162/7,168/2,168/2,162/7,SRH,Sunrisers won by 8 wkts (5b rem),2022-04-11T14:00Z,2022-04-12T23:59Z,343050,"Dr DY Patil Sports Academy, Navi Mumbai",Kane Williamson,Hardik Pandya,Kane Williamson,"Sunrisers Hyderabad 2, Gujarat Titans 0",False,19.1,168,2,19,20,162,7,18,,"Kane Williamson,Abhishek Sharma","T Natarajan,Bhuvneshwar Kumar","Abhishek Sharma (AR),Kane Williamson (UKN),Rahul Tripathi (UKN),Nicholas Pooran (WK),Aiden Markram (UKN),Shashank Singh (AR),Washington Sundar (AR),Marco Jansen (AR),Bhuvneshwar Kumar (BL),T Natarajan (BL),Umran Malik (BL)","Matthew Wade (WK),Shubman Gill (UKN),Sai Sudharsan (UKN),Hardik Pandya (AR),David Miller (UKN),Abhinav Manohar (AR),Rahul Tewatia (AR),Rashid Khan (BL),Darshan Nalkande (BL),Mohammed Shami (BL),Lockie Ferguson (BL)","Hardik Pandya,Abhinav Manohar","Hardik Pandya,Rashid Khan",11 April 2022 - night match (20-over match),Chirra Ravikanthreddy,Rod Tucker,Virender Sharma,Daniel Manohar,Nikhil Patwardhan
2022,1304068,Chennai Super Kings v Royal Challengers Bangalore,CSK v RCB,"22nd Match (N), Indian Premier League at Navi Mumbai, Apr 12 2022",CSK,RCB,RCB,BOWL FIRST,216/4,193/9,216/4,193/9,CSK,Super Kings won by 23 runs,2022-04-12T14:00Z,2022-04-13T23:59Z,343050,"Dr DY Patil Sports Academy, Navi Mumbai",Ravindra Jadeja,Faf du Plessis,Shivam Dube,"Chennai Super Kings 2, Royal Challengers Bangalore 0",False,20,216,4,29,20,193,9,24,CSK get on the board after Dube-Uthappa show. Theekshana leads the bowling effort with four-for after batters turn on the style to put up huge total,"Shivam Dube,Robin Uthappa","Maheesh Theekshana,Ravindra Jadeja","Ruturaj Gaikwad (UKN),Robin Uthappa (UKN),Moeen Ali (AR),Shivam Dube (AR),Ravindra Jadeja (AR),MS Dhoni (WK),Ambati Rayudu (UKN),Dwayne Bravo (AR),Chris Jordan (BL),Maheesh Theekshana (BL),Mukesh Choudhary (BL)","Faf du Plessis (UKN),Anuj Rawat (UKN),Virat Kohli (UKN),Glenn Maxwell (AR),Shahbaz Ahmed (AR),Suyash Prabhudessai (AR),Dinesh Karthik (WK),Wanindu Hasaranga de Silva (AR),Akash Deep (AR),Mohammed Siraj (BL),Josh Hazlewood (BL)","Shahbaz Ahmed,Suyash Prabhudessai","Wanindu Hasaranga de Silva,Josh Hazlewood",12 April 2022 - night match (20-over match),Nitin Menon,Nitin Pandit,Yeshwant Barde,Javagal Srinath,Akshay Totre
2022,1304069,Mumbai Indians v Punjab Kings,MI v PBKS,"23rd Match (N), Indian Premier League at Pune, Apr 13 2022",MI,PBKS,MI,BOWL FIRST,198/5,186/9,186/9,198/5,PBKS,Punjab Kings won by 12 runs,2022-04-13T14:00Z,2022-04-14T23:59Z,545380,"Maharashtra Cricket Association Stadium, Pune",Rohit Sharma,Mayank Agarwal,Mayank Agarwal,"Punjab Kings 2, Mumbai Indians 0",False,20,186,9,26,20,198,5,23,"Mumbai run out of power, crashing to fifth straight loss. Brevis and Tilak Varma put on a show, but Punjab Kings had enough on the board to weather it","Dewald Brevis,Suryakumar Yadav","Basil Thampi,Jasprit Bumrah","Rohit Sharma (UKN),Ishan Kishan (WK),Dewald Brevis (AR),Tilak Varma (AR),Suryakumar Yadav (UKN),Kieron Pollard (AR),Jaydev Unadkat (BL),Murugan Ashwin (BL),Jasprit Bumrah (BL),Tymal Mills (BL),Basil Thampi (BL)","Mayank Agarwal (UKN),Shikhar Dhawan (UKN),Jonny Bairstow (UKN),Liam Livingstone (AR),Jitesh Sharma (WK),M Shahrukh Khan (UKN),Odean Smith (AR),Kagiso Rabada (BL),Rahul Chahar (BL),Vaibhav Arora (BL),Arshdeep Singh (BL)","Shikhar Dhawan,Mayank Agarwal","Odean Smith,Kagiso Rabada",13 April 2022 - night match (20-over match),Ulhas Gandhe,Bruce Oxenford,KN Ananthapadmanabhan,Narayanan Kutty,Saidharshan Kumar
2022,1304070,Rajasthan Royals v Gujarat Titans,RR v GT,"24th Match (N), Indian Premier League at Navi Mumbai, Apr 14 2022",RR,GT,RR,BOWL FIRST,192/4,155/9,155/9,192/4,GT,Titans won by 37 runs,2022-04-14T14:00Z,2022-04-15T23:59Z,343050,"Dr DY Patil Sports Academy, Navi Mumbai",Sanju Samson,Hardik Pandya,Hardik Pandya,"Gujarat Titans 2, Rajasthan Royals 0",False,20,155,9,19,20,192,4,29,"Hardik brings the thrill as Titans top table. Ferguson, Dayal impress with the ball; Buttler's 23-ball fifty not enough for Royals","Jos Buttler,Shimron Hetmyer","Yuzvendra Chahal,Riyan Parag","Jos Buttler (UKN),Devdutt Padikkal (UKN),Ravichandran Ashwin (AR),Sanju Samson (WK),Rassie van der Dussen (UKN),Shimron Hetmyer (UKN),Riyan Parag (UKN),James Neesham (AR),Prasidh Krishna (BL),Yuzvendra Chahal (BL),Kuldeep Sen (BL)","Matthew Wade (WK),Shubman Gill (UKN),Vijay Shankar (AR),Hardik Pandya (AR),Abhinav Manohar (AR),David Miller (UKN),Rahul Tewatia (AR),Rashid Khan (BL),Mohammed Shami (BL),Lockie Ferguson (BL),Yash Dayal (BL)","Hardik Pandya,Abhinav Manohar","Lockie Ferguson,Yash Dayal",14 April 2022 - night match (20-over match),Chris Gaffaney,Rohan Pandit,Jayaraman Madanagopal,Manu Nayyar,Tapan Sharma
2022,1304071,Sunrisers Hyderabad v Kolkata Knight Riders,SRH v KKR,"25th Match (N), Indian Premier League at Mumbai, Apr 15 2022",SRH,KKR,SRH,BOWL FIRST,175/8,176/3,176/3,175/8,SRH,Sunrisers won by 7 wkts (13b rem),2022-04-15T14:00Z,2022-04-16T23:59Z,58317,"Brabourne Stadium, Mumbai",Kane Williamson,Shreyas Iyer,Rahul Tripathi,"Sunrisers Hyderabad 2, Kolkata Knight Riders 0",False,17.5,176,3,23,20,175,8,24,"Tripathi, Markram hit fifties as Sunrisers make it three in a row. Earlier, an impressive show from Sunrisers' pace pack kept Knight Riders to a gettable total","Rahul Tripathi,Aiden Markram","T Natarajan,Umran Malik","Abhishek Sharma (AR),Kane Williamson (UKN),Rahul Tripathi (UKN),Aiden Markram (UKN),Nicholas Pooran (WK),Shashank Singh (AR),Jagadeesha Suchith (BL),Marco Jansen (AR),Bhuvneshwar Kumar (BL),T Natarajan (BL),Umran Malik (BL)","Venkatesh Iyer (AR),Aaron Finch (UKN),Shreyas Iyer (UKN),Sunil Narine (AR),Nitish Rana (UKN),Sheldon Jackson (WK),Andre Russell (AR),Pat Cummins (BL),Aman Hakim Khan (BL),Umesh Yadav (BL),Varun Chakravarthy (BL)","Nitish Rana,Andre Russell","Andre Russell,Pat Cummins",15 April 2022 - night match (20-over match),Sadashiv Iyer,Virender Sharma,Saiyed Khalid,Prakash Bhatt,Pashchim Pathak
2022,1304072,Mumbai Indians v Lucknow Super Giants,MI v LSG,"26th Match (D/N), Indian Premier League at Mumbai, Apr 16 2022",MI,LSG,MI,BOWL FIRST,199/4,181/9,181/9,199/4,LSG,Super Giants won by 18 runs,2022-04-16T10:00Z,2022-04-17T23:59Z,58317,"Brabourne Stadium, Mumbai",Rohit Sharma,KL Rahul,KL Rahul,"Lucknow Super Giants 2, Mumbai Indians 0",False,20,181,9,23,20,199,4,28,"Rahul 103*, Avesh three-for headline dominant Super Giants' fourth win. Poor fielding and wayward bowling compound matters for Mumbai Indians, who have now lost six games on the bounce","Suryakumar Yadav,Dewald Brevis","Jaydev Unadkat,Murugan Ashwin","Ishan Kishan (WK),Rohit Sharma (UKN),Dewald Brevis (AR),Suryakumar Yadav (UKN),Tilak Varma (AR),Kieron Pollard (AR),Fabian Allen (AR),Jaydev Unadkat (BL),Murugan Ashwin (BL),Jasprit Bumrah (BL),Tymal Mills (BL)","KL Rahul (UKN),Quinton de Kock (WK),Manish Pandey (UKN),Marcus Stoinis (AR),Deepak Hooda (AR),Krunal Pandya (AR),Ayush Badoni (UKN),Jason Holder (AR),Dushmantha Chameera (BL),Avesh Khan (BL),Ravi Bishnoi (BL)","KL Rahul,Manish Pandey","Avesh Khan,Marcus Stoinis",16 April 2022 - day/night match (20-over match),Anil Chaudhary,Nikhil Patwardhan,Navdeep Singh,Shakti Singh,Yeshwant Barde
2022,1304073,Delhi Capitals v Royal Challengers Bangalore,DC v RCB,"27th Match (N), Indian Premier League at Mumbai, Apr 16 2022",DC,RCB,DC,BOWL FIRST,189/5,173/7,173/7,189/5,RCB,RCB won by 16 runs,2022-04-16T14:00Z,2022-04-17T23:59Z,58324,"Wankhede Stadium, Mumbai",Rishabh Pant,Faf du Plessis,Dinesh Karthik,"Royal Challengers Bangalore 2, Delhi Capitals 0",False,20,173,7,21,20,189,5,27,"Another Dinesh Karthik blitz fashions Royal Challengers' victory. Glenn Maxwell did the early legwork with a fifty of his own, rendering a David Warner special in vain","David Warner,Rishabh Pant","Shardul Thakur,Axar Patel","Prithvi Shaw (UKN),David Warner (UKN),Mitchell Marsh (AR),Rishabh Pant (WK),Rovman Powell (UKN),Lalit Yadav (AR),Shardul Thakur (BL),Axar Patel (AR),Kuldeep Yadav (BL),Mustafizur Rahman (BL),Khaleel Ahmed (BL)","Faf du Plessis (UKN),Anuj Rawat (UKN),Virat Kohli (UKN),Glenn Maxwell (AR),Suyash Prabhudessai (AR),Shahbaz Ahmed (AR),Dinesh Karthik (WK),Wanindu Hasaranga de Silva (AR),Mohammed Siraj (BL),Harshal Patel (BL),Josh Hazlewood (BL)","Dinesh Karthik,Glenn Maxwell","Josh Hazlewood,Mohammed Siraj",16 April 2022 - night match (20-over match),Jayaraman Madanagopal,Chirra Ravikanthreddy,Chris Gaffaney,Javagal Srinath,Nitin Pandit
2022,1304074,Punjab Kings v Sunrisers Hyderabad,PBKS v SRH,"28th Match (D/N), Indian Premier League at Navi Mumbai, Apr 17 2022",PBKS,SRH,SRH,BOWL FIRST,151,152/3,151,152/3,SRH,Sunrisers won by 7 wkts (7b rem),2022-04-17T10:00Z,2022-04-18T23:59Z,343050,"Dr DY Patil Sports Academy, Navi Mumbai",Shikhar Dhawan,Kane Williamson,Umran Malik,"Sunrisers Hyderabad 2, Punjab Kings 0",False,20,151,10,20,18.5,152,3,16,"Bhuvneshwar, Umran Malik share seven wickets to guide Sunrisers into top four. Sunrisers registered their fourth successive victory to be placed fourth on the table with eight points","Liam Livingstone,M Shahrukh Khan","Rahul Chahar,Kagiso Rabada","Shikhar Dhawan (UKN),Prabhsimran Singh (UKN),Jonny Bairstow (UKN),Liam Livingstone (AR),Jitesh Sharma (WK),M Shahrukh Khan (UKN),Odean Smith (AR),Kagiso Rabada (BL),Rahul Chahar (BL),Vaibhav Arora (BL),Arshdeep Singh (BL)","Abhishek Sharma (AR),Kane Williamson (UKN),Rahul Tripathi (UKN),Aiden Markram (UKN),Nicholas Pooran (WK),Shashank Singh (AR),Jagadeesha Suchith (BL),Bhuvneshwar Kumar (BL),Marco Jansen (AR),T Natarajan (BL),Umran Malik (BL)","Aiden Markram,Nicholas Pooran","Umran Malik,Bhuvneshwar Kumar",17 April 2022 - day/night match (20-over match),Rohan Pandit,Pashchim Pathak,Rod Tucker,Daniel Manohar,Akshay Totre
2022,1304075,Gujarat Titans v Chennai Super Kings,GT v CSK,"29th Match (N), Indian Premier League at Pune, Apr 17 2022",GT,CSK,GT,BOWL FIRST,169/5,170/7,170/7,169/5,GT,Titans won by 3 wkts (1b rem),2022-04-17T14:00Z,2022-04-18T23:59Z,545380,"Maharashtra Cricket Association Stadium, Pune",Rashid Khan,Ravindra Jadeja,David Miller,"Gujarat Titans 2, Chennai Super Kings 0",False,19.5,170,7,21,20,169,5,20,David Miller classic brings the house down on Chennai Super Kings. Rashid Khan cameo at the end helps Gujarat Titans seal victory despite their having been 16 for 3 and 87 for 5,"David Miller,Rashid Khan","Alzarri Joseph,Mohammed Shami","Wriddhiman Saha (WK),Shubman Gill (UKN),Vijay Shankar (AR),Abhinav Manohar (AR),David Miller (UKN),Rahul Tewatia (AR),Rashid Khan (BL),Alzarri Joseph (BL),Lockie Ferguson (BL),Mohammed Shami (BL),Yash Dayal (BL)","Ruturaj Gaikwad (UKN),Robin Uthappa (UKN),Moeen Ali (AR),Ambati Rayudu (UKN),Shivam Dube (AR),Ravindra Jadeja (AR),MS Dhoni (WK),Dwayne Bravo (AR),Chris Jordan (BL),Maheesh Theekshana (BL),Mukesh Choudhary (BL)","Ruturaj Gaikwad,Ambati Rayudu","Dwayne Bravo,Maheesh Theekshana",17 April 2022 - night match (20-over match),KN Ananthapadmanabhan,Ulhas Gandhe,Bruce Oxenford,Narayanan Kutty,Vinod Seshan
2022,1304076,Rajasthan Royals v Kolkata Knight Riders,RR v KKR,"30th Match (N), Indian Premier League at Mumbai, Apr 18 2022",RR,KKR,KKR,BOWL FIRST,217/5,210,217/5,210,RR,Royals won by 7 runs,2022-04-18T14:00Z,2022-04-19T23:59Z,58317,"Brabourne Stadium, Mumbai",Sanju Samson,Shreyas Iyer,Yuzvendra Chahal,"Rajasthan Royals 2, Kolkata Knight Riders 0",False,20,217,5,28,19.4,210,10,27,"Jos Buttler ton, Yuzvendra Chahal hat-trick give Rajasthan Royals narrow win. Finch, Shreyas half-centuries and Umesh's late blitz gave Knight Riders a chance before they fell short in big chase","Jos Buttler,Sanju Samson","Yuzvendra Chahal,Obed McCoy","Jos Buttler (UKN),Devdutt Padikkal (UKN),Sanju Samson (WK),Shimron Hetmyer (UKN),Riyan Parag (UKN),Karun Nair (UKN),Ravichandran Ashwin (AR),Trent Boult (BL),Obed McCoy (BL),Prasidh Krishna (BL),Yuzvendra Chahal (BL)","Aaron Finch (UKN),Sunil Narine (AR),Shreyas Iyer (UKN),Nitish Rana (UKN),Andre Russell (AR),Venkatesh Iyer (AR),Sheldon Jackson (WK),Shivam Mavi (AR),Pat Cummins (BL),Umesh Yadav (BL),Varun Chakravarthy (BL)","Shreyas Iyer,Aaron Finch","Sunil Narine,Andre Russell",18 April 2022 - night match (20-over match),Sadashiv Iyer,Virender Sharma,Nitin Menon,Manu Nayyar,Nikhil Patwardhan
2022,1304077,Lucknow Super Giants v Royal Challengers Bangalore,LSG v RCB,"31st Match (N), Indian Premier League at Navi Mumbai, Apr 19 2022",LSG,RCB,LSG,BOWL FIRST,181/6,163/8,163/8,181/6,RCB,RCB won by 18 runs,2022-04-19T14:00Z,2022-04-20T23:59Z,343050,"Dr DY Patil Sports Academy, Navi Mumbai",KL Rahul,Faf du Plessis,Faf du Plessis,"Royal Challengers Bangalore 2, Lucknow Super Giants 0",False,20,163,8,20,20,181,6,21,Faf du Plessis and Josh Hazlewood put Royal Challengers in top two. Glenn Maxwell and Shahbaz Ahmed also played crucial roles in an 18-run victory,"Krunal Pandya,KL Rahul","Jason Holder,Dushmantha Chameera","Quinton de Kock (WK),KL Rahul (UKN),Manish Pandey (UKN),Krunal Pandya (AR),Deepak Hooda (AR),Ayush Badoni (UKN),Marcus Stoinis (AR),Jason Holder (AR),Dushmantha Chameera (BL),Ravi Bishnoi (BL),Avesh Khan (BL)","Anuj Rawat (UKN),Faf du Plessis (UKN),Virat Kohli (UKN),Glenn Maxwell (AR),Suyash Prabhudessai (AR),Shahbaz Ahmed (AR),Dinesh Karthik (WK),Harshal Patel (BL),Wanindu Hasaranga de Silva (AR),Josh Hazlewood (BL),Mohammed Siraj (BL)","Faf du Plessis,Shahbaz Ahmed","Josh Hazlewood,Harshal Patel",19 April 2022 - night match (20-over match),Chris Gaffaney,Nitin Pandit,Jayaraman Madanagopal,Prakash Bhatt,Chirra Ravikanthreddy
2022,1304078,Delhi Capitals v Punjab Kings,DC v PBKS,"32nd Match (N), Indian Premier League at Mumbai, Apr 20 2022",DC,PBKS,DC,BOWL FIRST,115,119/1,119/1,115,DC,Capitals won by 9 wkts (57b rem),2022-04-20T14:00Z,2022-04-21T23:59Z,58317,"Brabourne Stadium, Mumbai",Rishabh Pant,Mayank Agarwal,Kuldeep Yadav,"Delhi Capitals 2, Punjab Kings 0",False,10.3,119,1,20,20,115,10,16,"All-star bowling, big Warner-Shaw stand lead Capitals demolition of Kings. Capitals race to 81 inside powerplay, and past the target in 10.3 overs, after restricting Kings to 115, the lowest total this season","David Warner,Prithvi Shaw","Axar Patel,Lalit Yadav","Prithvi Shaw (UKN),David Warner (UKN),Sarfaraz Khan (UKN),Rishabh Pant (WK),Rovman Powell (UKN),Lalit Yadav (AR),Shardul Thakur (BL),Axar Patel (AR),Kuldeep Yadav (BL),Mustafizur Rahman (BL),Khaleel Ahmed (BL)","Mayank Agarwal (UKN),Shikhar Dhawan (UKN),Jonny Bairstow (UKN),Liam Livingstone (AR),Jitesh Sharma (WK),M Shahrukh Khan (UKN),Kagiso Rabada (BL),Nathan Ellis (BL),Rahul Chahar (BL),Arshdeep Singh (BL),Vaibhav Arora (BL)","Jitesh Sharma,Mayank Agarwal","Rahul Chahar,Kagiso Rabada",20 April 2022 - night match (20-over match),Tapan Sharma,Rod Tucker,Anil Chaudhary,Shakti Singh,Rohan Pandit
2022,1304079,Mumbai Indians v Chennai Super Kings,MI v CSK,"33rd Match (N), Indian Premier League at Navi Mumbai, Apr 21 2022",MI,CSK,CSK,BOWL FIRST,155/7,156/7,155/7,156/7,CSK,Super Kings won by 3 wkts (0b rem),2022-04-21T14:00Z,2022-04-22T23:59Z,343050,"Dr DY Patil Sports Academy, Navi Mumbai",Rohit Sharma,Ravindra Jadeja,Mukesh Choudhary,"Chennai Super Kings 2, Mumbai Indians 0",False,20,155,7,17,20,156,7,19,Dhoni the finisher rescues Chennai Super Kings in last-ball thriller. Pretorius and Choudhary play equally important roles in victory; Mumbai have now lost seven,"Tilak Varma,Suryakumar Yadav","Daniel Sams,Jaydev Unadkat","Rohit Sharma (UKN),Ishan Kishan (WK),Dewald Brevis (AR),Suryakumar Yadav (UKN),Tilak Varma (AR),Hrithik Shokeen (BL),Kieron Pollard (AR),Daniel Sams (AR),Jaydev Unadkat (BL),Riley Meredith (BL),Jasprit Bumrah (BL)","Ruturaj Gaikwad (UKN),Robin Uthappa (UKN),Mitchell Santner (AR),Ambati Rayudu (UKN),Shivam Dube (AR),Ravindra Jadeja (AR),MS Dhoni (WK),Dwaine Pretorius (AR),Dwayne Bravo (AR),Mukesh Choudhary (BL),Maheesh Theekshana (BL)","Ambati Rayudu,Robin Uthappa","Mukesh Choudhary,Dwayne Bravo",21 April 2022 - night match (20-over match),Ulhas Gandhe,Bruce Oxenford,KN Ananthapadmanabhan,Narayanan Kutty,Saidharshan Kumar
2022,1304080,Delhi Capitals v Rajasthan Royals,DC v RR,"34th Match (N), Indian Premier League at Mumbai, Apr 22 2022",DC,RR,DC,BOWL FIRST,222/2,207/8,207/8,222/2,RR,Royals won by 15 runs,2022-04-22T14:00Z,2022-04-23T23:59Z,58324,"Wankhede Stadium, Mumbai",Rishabh Pant,Sanju Samson,Jos Buttler,"Rajasthan Royals 2, Delhi Capitals 0",False,20,207,8,29,20,222,2,35,"Another Buttler century, Prasidh three-for clinch run-fest against Capitals. Powell gave Capitals a sniff with three back-to-back sixes in the last over and a controversy followed","Rishabh Pant,Prithvi Shaw","Mustafizur Rahman,Khaleel Ahmed","Prithvi Shaw (UKN),David Warner (UKN),Sarfaraz Khan (UKN),Rishabh Pant (WK),Lalit Yadav (AR),Axar Patel (AR),Shardul Thakur (BL),Rovman Powell (UKN),Kuldeep Yadav (BL),Mustafizur Rahman (BL),Khaleel Ahmed (BL)","Jos Buttler (UKN),Devdutt Padikkal (UKN),Sanju Samson (WK),Shimron Hetmyer (UKN),Riyan Parag (UKN),Karun Nair (UKN),Ravichandran Ashwin (AR),Trent Boult (BL),Obed McCoy (BL),Prasidh Krishna (BL),Yuzvendra Chahal (BL)","Jos Buttler,Devdutt Padikkal","Prasidh Krishna,Ravichandran Ashwin",22 April 2022 - night match (20-over match),Nitin Menon,Nikhil Patwardhan,Yeshwant Barde,Daniel Manohar,Sadashiv Iyer
2022,1304081,Kolkata Knight Riders v Gujarat Titans,KKR v GT,"35th Match (D/N), Indian Premier League at Navi Mumbai, Apr 23 2022",KKR,GT,GT,BAT FIRST,156/9,148/8,148/8,156/9,GT,Titans won by 8 runs,2022-04-23T10:00Z,2022-04-24T23:59Z,343050,"Dr DY Patil Sports Academy, Navi Mumbai",Shreyas Iyer,Hardik Pandya,Rashid Khan,"Gujarat Titans 2, Kolkata Knight Riders 0",False,20,148,8,20,20,156,9,15,Shami-led Titans bowling attack thwarts Russell-powered Knight Riders. Titans climb to the top of the table after Hardik Pandya becomes first captain to bat first after winning the toss,"Andre Russell,Rinku Singh","Andre Russell,Tim Southee","Sam Billings (WK),Sunil Narine (AR),Shreyas Iyer (UKN),Nitish Rana (UKN),Rinku Singh (UKN),Venkatesh Iyer (AR),Andre Russell (AR),Shivam Mavi (AR),Umesh Yadav (BL),Tim Southee (BL),Varun Chakravarthy (BL)","Wriddhiman Saha (WK),Shubman Gill (UKN),Hardik Pandya (AR),David Miller (UKN),Rahul Tewatia (AR),Rashid Khan (BL),Abhinav Manohar (AR),Lockie Ferguson (BL),Alzarri Joseph (BL),Yash Dayal (BL),Mohammed Shami (BL)","Hardik Pandya,David Miller","Mohammed Shami,Rashid Khan",23 April 2022 - day/night match (20-over match),KN Ananthapadmanabhan,Ulhas Gandhe,Bruce Oxenford,Narayanan Kutty,Vinod Seshan
2022,1304082,Royal Challengers Bangalore v Sunrisers Hyderabad,RCB v SRH,"36th Match (N), Indian Premier League at Mumbai, Apr 23 2022",RCB,SRH,SRH,BOWL FIRST,68,72/1,68,72/1,SRH,Sunrisers won by 9 wkts (72b rem),2022-04-23T14:00Z,2022-04-24T23:59Z,58317,"Brabourne Stadium, Mumbai",Faf du Plessis,Kane Williamson,Marco Jansen,"Sunrisers Hyderabad 2, Royal Challengers Bangalore 0",False,16.1,68,10,6,8,72,1,12,"Marco Jansen, T Natarajan lead Sunrisers Hyderabad's rout of Royal Challengers Bangalore. The game lasted all of 24.1 overs after Royal Challengers folded for 68","Suyash Prabhudessai,Glenn Maxwell","Harshal Patel,Josh Hazlewood","Faf du Plessis (UKN),Anuj Rawat (UKN),Virat Kohli (UKN),Glenn Maxwell (AR),Suyash Prabhudessai (AR),Shahbaz Ahmed (AR),Dinesh Karthik (WK),Harshal Patel (BL),Wanindu Hasaranga de Silva (AR),Josh Hazlewood (BL),Mohammed Siraj (BL)","Abhishek Sharma (AR),Kane Williamson (UKN),Rahul Tripathi (UKN),Aiden Markram (UKN),Nicholas Pooran (WK),Shashank Singh (AR),Jagadeesha Suchith (BL),Bhuvneshwar Kumar (BL),Marco Jansen (AR),T Natarajan (BL),Umran Malik (BL)","Abhishek Sharma,Kane Williamson","T Natarajan,Marco Jansen",23 April 2022 - night match (20-over match),Jayaraman Madanagopal,Chirra Ravikanthreddy,Chris Gaffaney,Manu Nayyar,Saiyed Khalid
2022,1304083,Lucknow Super Giants v Mumbai Indians,LSG v MI,"37th Match (N), Indian Premier League at Mumbai, Apr 24 2022",LSG,MI,MI,BOWL FIRST,168/6,132/8,168/6,132/8,LSG,Super Giants won by 36 runs,2022-04-24T14:00Z,2022-04-25T23:59Z,58324,"Wankhede Stadium, Mumbai",KL Rahul,Rohit Sharma,KL Rahul,"Lucknow Super Giants 2, Mumbai Indians 0",False,20,168,6,20,20,132,8,12,"Rahul 103*, Krunal three-for send Mumbai hurtling to eighth defeat. The Lucknow Super Giants captain scored his third century against Mumbai, which is an IPL record","KL Rahul,Manish Pandey","Krunal Pandya,Ayush Badoni","Quinton de Kock (WK),KL Rahul (UKN),Manish Pandey (UKN),Marcus Stoinis (AR),Krunal Pandya (AR),Deepak Hooda (AR),Ayush Badoni (UKN),Jason Holder (AR),Dushmantha Chameera (BL),Ravi Bishnoi (BL),Mohsin Khan (BL)","Ishan Kishan (WK),Rohit Sharma (UKN),Dewald Brevis (AR),Suryakumar Yadav (UKN),Tilak Varma (AR),Kieron Pollard (AR),Daniel Sams (AR),Jaydev Unadkat (BL),Hrithik Shokeen (BL),Jasprit Bumrah (BL),Riley Meredith (BL)","Rohit Sharma,Tilak Varma","Kieron Pollard,Riley Meredith",24 April 2022 - night match (20-over match),Marais Erasmus,Saiyed Khalid,Virender Sharma,Shakti Singh,Nitin Pandit
2022,1304084,Punjab Kings v Chennai Super Kings,PBKS v CSK,"38th Match (N), Indian Premier League at Mumbai, Apr 25 2022",PBKS,CSK,CSK,BOWL FIRST,187/4,176/6,187/4,176/6,PBKS,Punjab Kings won by 11 runs,2022-04-25T14:00Z,2022-04-26T23:59Z,58324,"Wankhede Stadium, Mumbai",Mayank Agarwal,Ravindra Jadeja,Shikhar Dhawan,"Punjab Kings 2, Chennai Super Kings 0",False,20,187,4,21,20,176,6,23,"Arshdeep, Rabada death strangle after Shikhar Dhawan masterclass help Kings down Super Kings. Rayudu's 39-ball 78 raised hopes of a Super Kings win only to be dashed by tight overs by Kings at the death","Shikhar Dhawan,Bhanuka Rajapaksa","Kagiso Rabada,Rishi Dhawan","Mayank Agarwal (UKN),Shikhar Dhawan (UKN),Bhanuka Rajapaksa (UKN),Liam Livingstone (AR),Jonny Bairstow (UKN),Jitesh Sharma (WK),Rishi Dhawan (AR),Kagiso Rabada (BL),Rahul Chahar (BL),Arshdeep Singh (BL),Sandeep Sharma (BL)","Ruturaj Gaikwad (UKN),Robin Uthappa (UKN),Mitchell Santner (AR),Shivam Dube (AR),Ambati Rayudu (UKN),Ravindra Jadeja (AR),MS Dhoni (WK),Dwaine Pretorius (AR),Dwayne Bravo (AR),Mukesh Choudhary (BL),Maheesh Theekshana (BL)","Ambati Rayudu,Ruturaj Gaikwad","Dwayne Bravo,Maheesh Theekshana",25 April 2022 - night match (20-over match),Marais Erasmus,Tapan Sharma,Pashchim Pathak,Prakash Bhatt,Rohan Pandit
2022,1304085,Royal Challengers Bangalore v Rajasthan Royals,RCB v RR,"39th Match (N), Indian Premier League at Pune, Apr 26 2022",RCB,RR,RCB,BOWL FIRST,144/8,115,115,144/8,RR,Royals won by 29 runs,2022-04-26T14:00Z,2022-04-27T23:59Z,545380,"Maharashtra Cricket Association Stadium, Pune",Faf du Plessis,Sanju Samson,Riyan Parag,"Rajasthan Royals 2, Royal Challengers Bangalore 0",False,19.3,115,10,13,20,144,8,17,"Parag, Kuldeep and Ashwin rescue the Royals. The batter's 56* off 31 dragged his team from 99 for 5 to 144. Then the bowlers combined to take 7 for 37 to stymie RCB in their small chase","Faf du Plessis,Wanindu Hasaranga de Silva","Josh Hazlewood,Wanindu Hasaranga de Silva","Virat Kohli (UKN),Faf du Plessis (UKN),Rajat Patidar (UKN),Glenn Maxwell (AR),Shahbaz Ahmed (AR),Suyash Prabhudessai (AR),Dinesh Karthik (WK),Wanindu Hasaranga de Silva (AR),Harshal Patel (BL),Mohammed Siraj (BL),Josh Hazlewood (BL)","Jos Buttler (UKN),Devdutt Padikkal (UKN),Ravichandran Ashwin (AR),Sanju Samson (WK),Daryl Mitchell (AR),Riyan Parag (UKN),Shimron Hetmyer (UKN),Trent Boult (BL),Prasidh Krishna (BL),Yuzvendra Chahal (BL),Kuldeep Sen (BL)","Riyan Parag,Sanju Samson","Kuldeep Sen,Ravichandran Ashwin",26 April 2022 - night match (20-over match),KN Ananthapadmanabhan,Bruce Oxenford,Ulhas Gandhe,Narayanan Kutty,Saidharshan Kumar
2022,1304086,Gujarat Titans v Sunrisers Hyderabad,GT v SRH,"40th Match (N), Indian Premier League at Mumbai, Apr 27 2022",GT,SRH,GT,BOWL FIRST,195/6,199/5,199/5,195/6,GT,Titans won by 5 wkts (0b rem),2022-04-27T14:00Z,2022-04-28T23:59Z,58324,"Wankhede Stadium, Mumbai",Hardik Pandya,Kane Williamson,Umran Malik,"Gujarat Titans 2, Sunrisers Hyderabad 0",False,20,199,5,27,20,195,6,23,"Rashid, Tewatia pull off another final-ball heist for Titans. Umran Malik's five-for goes in vain as Titans hit four sixes in the last over","Wriddhiman Saha,Rahul Tewatia","Mohammed Shami,Yash Dayal","Wriddhiman Saha (WK),Shubman Gill (UKN),Hardik Pandya (AR),David Miller (UKN),Rahul Tewatia (AR),Abhinav Manohar (AR),Rashid Khan (BL),Lockie Ferguson (BL),Alzarri Joseph (BL),Yash Dayal (BL),Mohammed Shami (BL)","Abhishek Sharma (AR),Kane Williamson (UKN),Rahul Tripathi (UKN),Aiden Markram (UKN),Nicholas Pooran (WK),Washington Sundar (AR),Shashank Singh (AR),Marco Jansen (AR),Bhuvneshwar Kumar (BL),T Natarajan (BL),Umran Malik (BL)","Abhishek Sharma,Aiden Markram","Umran Malik,T Natarajan",27 April 2022 - night match (20-over match),Chris Gaffaney,Navdeep Singh,Jayaraman Madanagopal,Shakti Singh,Sadashiv Iyer
