season,id,name,short_name,description,home_team,away_team,toss_won,decision,1st_inning_score,2nd_inning_score,home_score,away_score,winner,result,start_date,end_date,venue_id,venue_name,home_captain,away_captain,pom,points,super_over,home_overs,home_runs,home_wickets,home_boundaries,away_overs,away_runs,away_wickets,away_boundaries,highlights,home_key_batsman,home_key_bowler,home_playx1,away_playx1,away_key_batsman,away_key_bowler,match_days,umpire1,umpire2,tv_umpire,referee,reserve_umpire
2022,1304107,Kolkata Knight Riders v Sunrisers Hyderabad,KKR v SRH,"61st Match (N), Indian Premier League at Pune, May 14 2022",KKR,SRH,KKR,BAT FIRST,177/6,123/8,177/6,123/8,KKR,KKR won by 54 runs,2022-05-14T14:00Z,2022-05-15T23:59Z,545380,"Maharashtra Cricket Association Stadium, Pune",Shreyas Iyer,Kane Williamson,Andre Russell,"Kolkata Knight Riders 2, Sunrisers Hyderabad 0",False,20,177,6,21,20,123,8,13,Russell's 49* and three wickets keep Knight Riders' hopes alive. A 54-run win gave Knight Riders a healthy NRR boost while leaving Sunrisers on the brink of elimination,"Andre Russell,Sam Billings","Andre Russell,Tim Southee","Venkatesh Iyer (AR),Ajinkya Rahane (UKN),Nitish Rana (UKN),Shreyas Iyer (UKN),Sam Billings (WK),Rinku Singh (UKN),Andre Russell (AR),Sunil Narine (AR),Umesh Yadav (BL),Tim Southee (BL),Varun Chakravarthy (BL)","Abhishek Sharma (AR),Kane Williamson (UKN),Rahul Tripathi (UKN),Aiden Markram (UKN),Nicholas Pooran (WK),Washington Sundar (AR),Shashank Singh (AR),Marco Jansen (AR),Bhuvneshwar Kumar (BL),Umran Malik (BL),T Natarajan (BL)","Abhishek Sharma,Aiden Markram","Umran Malik,Bhuvneshwar Kumar",14 May 2022 - night match (20-over match),KN Ananthapadmanabhan,Anil Chaudhary,Michael Gough,Narayanan Kutty,Saidharshan Kumar
2022,1304108,Chennai Super Kings v Gujarat Titans,CSK v GT,"62nd Match (D/N), Indian Premier League at Mumbai, May 15 2022",CSK,GT,CSK,BAT FIRST,133/5,137/3,133/5,137/3,GT,Titans won by 7 wkts (5b rem),2022-05-15T10:00Z,2022-05-16T23:59Z,58324,"Wankhede Stadium, Mumbai",MS Dhoni,Hardik Pandya,Wriddhiman Saha,"Gujarat Titans 2, Chennai Super Kings 0",False,20,133,5,11,19.1,137,3,16,Shami and Saha lead the way as Titans ensure top-two finish. An inexperienced CSK side chose to bat and limped to 133 despite only losing five wickets,"Ruturaj Gaikwad,Narayan Jagadeesan","Matheesha Pathirana,Moeen Ali","Ruturaj Gaikwad (UKN),Devon Conway (UKN),Moeen Ali (AR),Narayan Jagadeesan (UKN),Shivam Dube (AR),MS Dhoni (WK),Mitchell Santner (AR),Prashant Solanki (BL),Simarjeet Singh (BL),Matheesha Pathirana (BL),Mukesh Choudhary (BL)","Wriddhiman Saha (WK),Shubman Gill (UKN),Matthew Wade (UKN),Hardik Pandya (AR),David Miller (UKN),Rahul Tewatia (AR),Rashid Khan (BL),Ravisrinivasan Sai Kishore (BL),Alzarri Joseph (BL),Yash Dayal (BL),Mohammed Shami (BL)","Wriddhiman Saha,Matthew Wade","Mohammed Shami,Alzarri Joseph",15 May 2022 - day/night match (20-over match),Rohan Pandit,Virender Sharma,Chris Gaffaney,Javagal Srinath,Nikhil Patwardhan
2022,1304109,Lucknow Super Giants v Rajasthan Royals,LSG v RR,"63rd Match (N), Indian Premier League at Mumbai, May 15 2022",LSG,RR,RR,BAT FIRST,178/6,154/8,154/8,178/6,RR,Royals won by 24 runs,2022-05-15T14:00Z,2022-05-16T23:59Z,58317,"Brabourne Stadium, Mumbai",KL Rahul,Sanju Samson,Trent Boult,"Rajasthan Royals 2, Lucknow Super Giants 0",False,20,154,8,15,20,178,6,26,"Padikkal, Boult and Ashwin help Royals leapfrog Super Giants to No. 2. Deepak Hooda's 39-ball 59 went in vain as Super Giants fell short in a chase of 179","Deepak Hooda,Marcus Stoinis","Ravi Bishnoi,Ayush Badoni","Quinton de Kock (WK),KL Rahul (UKN),Ayush Badoni (UKN),Deepak Hooda (AR),Krunal Pandya (AR),Marcus Stoinis (AR),Jason Holder (AR),Dushmantha Chameera (BL),Mohsin Khan (BL),Avesh Khan (BL),Ravi Bishnoi (BL)","Yashasvi Jaiswal (UKN),Jos Buttler (UKN),Sanju Samson (WK),Devdutt Padikkal (UKN),Riyan Parag (UKN),James Neesham (AR),Ravichandran Ashwin (AR),Trent Boult (BL),Prasidh Krishna (BL),Yuzvendra Chahal (BL),Obed McCoy (BL)","Yashasvi Jaiswal,Devdutt Padikkal","Trent Boult,Prasidh Krishna",15 May 2022 - night match (20-over match),Pashchim Pathak,Tapan Sharma,Bruce Oxenford,Prakash Bhatt,Yeshwant Barde
2022,1304110,Punjab Kings v Delhi Capitals,PBKS v DC,"64th Match (N), Indian Premier League at Navi Mumbai, May 16 2022",PBKS,DC,KXIP,BOWL FIRST,159/7,142/9,142/9,159/7,DC,Capitals won by 17 runs,2022-05-16T14:00Z,2022-05-17T23:59Z,343050,"Dr DY Patil Sports Academy, Navi Mumbai",Mayank Agarwal,Rishabh Pant,Shardul Thakur,"Delhi Capitals 2, Punjab Kings 0",False,20,142,9,18,20,159,7,18,"Marsh, Thakur, spin duo lift Capitals to fourth spot. Kuldeep, Axar share four wickets; Punjab Kings need a miracle to make the playoffs","Jitesh Sharma,Jonny Bairstow","Liam Livingstone,Arshdeep Singh","Jonny Bairstow (UKN),Shikhar Dhawan (UKN),Bhanuka Rajapaksa (UKN),Liam Livingstone (AR),Mayank Agarwal (UKN),Jitesh Sharma (WK),Harpreet Brar (BL),Rishi Dhawan (AR),Rahul Chahar (BL),Kagiso Rabada (BL),Arshdeep Singh (BL)","David Warner (UKN),Sarfaraz Khan (UKN),Mitchell Marsh (AR),Lalit Yadav (AR),Rishabh Pant (WK),Rovman Powell (UKN),Axar Patel (AR),Shardul Thakur (BL),Kuldeep Yadav (BL),Anrich Nortje (BL),Khaleel Ahmed (BL)","Mitchell Marsh,Sarfaraz Khan","Shardul Thakur,Axar Patel",16 May 2022 - night match (20-over match),Nitin Menon,Sadashiv Iyer,Michael Gough,Prakash Bhatt,Navdeep Singh
2022,1304111,Mumbai Indians v Sunrisers Hyderabad,MI v SRH,"65th Match (N), Indian Premier League at Mumbai, May 17 2022",MI,SRH,MI,BOWL FIRST,193/6,190/7,190/7,193/6,SRH,Sunrisers won by 3 runs,2022-05-17T14:00Z,2022-05-18T23:59Z,58324,"Wankhede Stadium, Mumbai",Rohit Sharma,Kane Williamson,Rahul Tripathi,"Sunrisers Hyderabad 2, Mumbai Indians 0",False,20,190,7,23,20,193,6,25,"Tripathi and Malik keep Sunrisers alive, but only just. Mumbai came close with Tim David's 18-ball 46, but fell short, and are now favourites to finish with the wooden spoon","Rohit Sharma,Tim David","Ramandeep Singh,Jasprit Bumrah","Rohit Sharma (UKN),Ishan Kishan (WK),Daniel Sams (AR),Tilak Varma (AR),Tim David (UKN),Tristan Stubbs (UKN),Ramandeep Singh (UKN),Sanjay Yadav (AR),Jasprit Bumrah (BL),Mayank Markande (BL),Riley Meredith (BL)","Abhishek Sharma (AR),Priyam Garg (UKN),Rahul Tripathi (UKN),Nicholas Pooran (WK),Aiden Markram (UKN),Kane Williamson (UKN),Washington Sundar (AR),Bhuvneshwar Kumar (BL),Umran Malik (BL),T Natarajan (BL),Fazalhaq Farooqi (BL)","Rahul Tripathi,Priyam Garg","Umran Malik,Bhuvneshwar Kumar",17 May 2022 - night match (20-over match),Chris Gaffaney,Nitin Pandit,Navdeep Singh,Javagal Srinath,Saiyed Khalid
2022,1304112,Kolkata Knight Riders v Lucknow Super Giants,KKR v LSG,"66th Match (N), Indian Premier League at Navi Mumbai, May 18 2022",KKR,LSG,LSG,BAT FIRST,210/0,208/8,208/8,210/0,LSG,Super Giants won by 2 runs,2022-05-18T14:00Z,2022-05-19T23:59Z,343050,"Dr DY Patil Sports Academy, Navi Mumbai",Shreyas Iyer,KL Rahul,Quinton de Kock,"Lucknow Super Giants 2, Kolkata Knight Riders 0",False,20,208,8,31,20,210,0,27,Quinton de Kock and Mohsin Khan knock KKR out in last-ball thriller. Super Giants move into plsyoffs after Rinku and Narine's sixer storm ends agonisingly short of victory,"Shreyas Iyer,Nitish Rana","Tim Southee,Andre Russell","Venkatesh Iyer (AR),Abhijeet Tomar (UKN),Nitish Rana (UKN),Shreyas Iyer (UKN),Sam Billings (WK),Andre Russell (AR),Rinku Singh (UKN),Sunil Narine (AR),Umesh Yadav (BL),Tim Southee (BL),Varun Chakravarthy (BL)","Quinton de Kock (WK),KL Rahul (UKN),Evin Lewis (UKN),Deepak Hooda (AR),Manan Vohra (UKN),Marcus Stoinis (AR),Jason Holder (AR),Krishnappa Gowtham (AR),Mohsin Khan (BL),Avesh Khan (BL),Ravi Bishnoi (BL)","Quinton de Kock,KL Rahul","Mohsin Khan,Marcus Stoinis",18 May 2022 - night match (20-over match),Yeshwant Barde,Rohan Pandit,Bruce Oxenford,Manu Nayyar,Nikhil Patwardhan
2022,1304113,Royal Challengers Bangalore v Gujarat Titans,RCB v GT,"67th Match (N), Indian Premier League at Mumbai, May 19 2022",RCB,GT,GT,BAT FIRST,168/5,170/2,170/2,168/5,RCB,RCB won by 8 wkts (8b rem),2022-05-19T14:00Z,2022-05-20T23:59Z,58324,"Wankhede Stadium, Mumbai",Faf du Plessis,Hardik Pandya,Virat Kohli,"Royal Challengers Bangalore 2, Gujarat Titans 0",False,18.4,170,2,22,20,168,5,21,Kohli 73 keeps RCB in playoff contention. A blistering 18-ball 40 from Glenn Maxwell finished the job as RCB sealed an impressive win,"Virat Kohli,Faf du Plessis","Josh Hazlewood,Wanindu Hasaranga de Silva","Virat Kohli (UKN),Faf du Plessis (UKN),Glenn Maxwell (AR),Dinesh Karthik (WK),Rajat Patidar (UKN),Mahipal Lomror (AR),Shahbaz Ahmed (AR),Harshal Patel (BL),Wanindu Hasaranga de Silva (AR),Josh Hazlewood (BL),Siddarth Kaul (BL)","Wriddhiman Saha (WK),Shubman Gill (UKN),Matthew Wade (UKN),Hardik Pandya (AR),David Miller (UKN),Rahul Tewatia (AR),Rashid Khan (BL),Ravisrinivasan Sai Kishore (BL),Lockie Ferguson (BL),Yash Dayal (BL),Mohammed Shami (BL)","Hardik Pandya,David Miller","Rashid Khan,Mohammed Shami",19 May 2022 - night match (20-over match),KN Ananthapadmanabhan,Sadashiv Iyer,Navdeep Singh,Javagal Srinath,Tapan Sharma
2022,1304114,Rajasthan Royals v Chennai Super Kings,RR v CSK,"68th Match (N), Indian Premier League at Mumbai, May 20 2022",RR,CSK,CSK,BAT FIRST,150/6,151/5,151/5,150/6,RR,Royals won by 5 wkts (2b rem),2022-05-20T14:00Z,2022-05-21T23:59Z,58317,"Brabourne Stadium, Mumbai",Sanju Samson,MS Dhoni,Ravichandran Ashwin,"Rajasthan Royals 2, Chennai Super Kings 0",False,19.4,151,5,18,20,150,6,20,"All-round Ashwin carries Royals to top-two finish, Moeen's 93 off 57 in vain. Promoted at No. 5, Ashwin hit an unbeaten 40 off 23 balls to go with his bowling analysis of 4-0-28-1","Yashasvi Jaiswal,Ravichandran Ashwin","Obed McCoy,Yuzvendra Chahal","Yashasvi Jaiswal (UKN),Jos Buttler (UKN),Sanju Samson (WK),Devdutt Padikkal (UKN),Ravichandran Ashwin (AR),Shimron Hetmyer (UKN),Riyan Parag (UKN),Trent Boult (BL),Yuzvendra Chahal (BL),Prasidh Krishna (BL),Obed McCoy (BL)","Ruturaj Gaikwad (UKN),Devon Conway (UKN),Moeen Ali (AR),Narayan Jagadeesan (UKN),Ambati Rayudu (UKN),MS Dhoni (WK),Mitchell Santner (AR),Simarjeet Singh (BL),Mukesh Choudhary (BL),Prashant Solanki (BL),Matheesha Pathirana (BL)","Moeen Ali,MS Dhoni","Prashant Solanki,Mitchell Santner",20 May 2022 - night match (20-over match),Chris Gaffaney,Nikhil Patwardhan,Yeshwant Barde,Manu Nayyar,Pashchim Pathak
2022,1304115,Mumbai Indians v Delhi Capitals,MI v DC,"69th Match (N), Indian Premier League at Mumbai, May 21 2022",MI,DC,MI,BOWL FIRST,159/7,160/5,160/5,159/7,MI,Mumbai won by 5 wkts (5b rem),2022-05-21T14:00Z,2022-05-22T23:59Z,58324,"Wankhede Stadium, Mumbai",Rohit Sharma,Rishabh Pant,Jasprit Bumrah,"Mumbai Indians 2, Delhi Capitals 0",False,19.1,160,5,21,20,159,7,17,"RCB sneak into playoffs after Tim David, Jasprit Bumrah knock Delhi Capitals out. David would have been out for 0 had Pant opted to review a caught-behind decision. He went onto smash 34 off 11 balls","Ishan Kishan,Dewald Brevis","Jasprit Bumrah,Ramandeep Singh","Ishan Kishan (WK),Rohit Sharma (UKN),Dewald Brevis (AR),Tilak Varma (AR),Tim David (UKN),Ramandeep Singh (UKN),Daniel Sams (AR),Hrithik Shokeen (BL),Jasprit Bumrah (BL),Mayank Markande (BL),Riley Meredith (BL)","Prithvi Shaw (UKN),David Warner (UKN),Mitchell Marsh (AR),Rishabh Pant (WK),Sarfaraz Khan (UKN),Rovman Powell (UKN),Axar Patel (AR),Shardul Thakur (BL),Kuldeep Yadav (BL),Anrich Nortje (BL),Khaleel Ahmed (BL)","Rovman Powell,Rishabh Pant","Anrich Nortje,Shardul Thakur",21 May 2022 - night match (20-over match),Nitin Menon,Tapan Sharma,Saiyed Khalid,Javagal Srinath,Sadashiv Iyer
2022,1304116,Sunrisers Hyderabad v Punjab Kings,SRH v PBKS,"70th Match (N), Indian Premier League at Mumbai, May 22 2022",SRH,PBKS,SRH,BAT FIRST,157/8,160/5,157/8,160/5,PBKS,Punjab Kings won by 5 wkts (29b rem),2022-05-22T14:00Z,2022-05-23T23:59Z,58324,"Wankhede Stadium, Mumbai",Bhuvneshwar Kumar,Mayank Agarwal,Harpreet Brar,"Punjab Kings 2, Sunrisers Hyderabad 0",False,20,157,8,19,15.1,160,5,24,"Brar, Livingstone help Kings finish on a high. Sunrisers did well to recover from 99 for 6, but their total of 157 wasn't nearly enough","Abhishek Sharma,Romario Shepherd","Fazalhaq Farooqi,Washington Sundar","Priyam Garg (UKN),Abhishek Sharma (AR),Rahul Tripathi (UKN),Aiden Markram (UKN),Nicholas Pooran (WK),Washington Sundar (AR),Romario Shepherd (AR),Jagadeesha Suchith (BL),Bhuvneshwar Kumar (BL),Umran Malik (BL),Fazalhaq Farooqi (BL)","Jonny Bairstow (UKN),Shikhar Dhawan (UKN),M Shahrukh Khan (UKN),Mayank Agarwal (UKN),Liam Livingstone (AR),Jitesh Sharma (WK),Prerak Mankad (AR),Harpreet Brar (BL),Kagiso Rabada (BL),Nathan Ellis (BL),Arshdeep Singh (BL)","Liam Livingstone,Shikhar Dhawan","Harpreet Brar,Nathan Ellis",22 May 2022 - night match (20-over match),Anil Chaudhary,Nikhil Patwardhan,Chris Gaffaney,Javagal Srinath,Navdeep Singh
2022,1312197,Gujarat Titans v Rajasthan Royals,GT v RR,"Qualifier 1 (N), Indian Premier League at Kolkata, May 24 2022",GT,RR,GT,BOWL FIRST,188/6,191/3,191/3,188/6,GT,Titans won by 7 wkts (3b rem),2022-05-24T14:00Z,2022-05-25T23:59Z,57980,"Eden Gardens, Kolkata",Hardik Pandya,Sanju Samson,David Miller,None,False,19.3,191,3,25,20,188,6,26,Miller and Hardik muscle Titans into the IPL final. Jos Buttler's 89 off 56 in vain but Royals will have a second shot at the title in Qualifier 2,"David Miller,Hardik Pandya","Hardik Pandya,Mohammed Shami","Wriddhiman Saha (WK),Shubman Gill (UKN),Matthew Wade (UKN),Hardik Pandya (AR),David Miller (UKN),Rahul Tewatia (AR),Rashid Khan (BL),Ravisrinivasan Sai Kishore (BL),Alzarri Joseph (BL),Yash Dayal (BL),Mohammed Shami (BL)","Yashasvi Jaiswal (UKN),Jos Buttler (UKN),Sanju Samson (WK),Devdutt Padikkal (UKN),Shimron Hetmyer (UKN),Riyan Parag (UKN),Ravichandran Ashwin (AR),Trent Boult (BL),Yuzvendra Chahal (BL),Prasidh Krishna (BL),Obed McCoy (BL)","Jos Buttler,Sanju Samson","Trent Boult,Obed McCoy",24 May 2022 - night match (20-over match),Bruce Oxenford,Virender Sharma,Michael Gough,Manu Nayyar,Jayaraman Madanagopal
2022,1312198,Lucknow Super Giants v Royal Challengers Bangalore,LSG v RCB,"Eliminator (N), Indian Premier League at Kolkata, May 25 2022",LSG,RCB,LSG,BOWL FIRST,207/4,193/6,193/6,207/4,RCB,RCB won by 14 runs,2022-05-25T14:00Z,2022-05-26T23:59Z,57980,"Eden Gardens, Kolkata",KL Rahul,Faf du Plessis,Rajat Patidar,None,False,20,193,6,20,20,207,4,30,Sparkling Patidar 112 knocks LSG out. Harshal and Hazlewood ace it at the death even as well-set Rahul fails to find fluency chasing 208,"KL Rahul,Deepak Hooda","Mohsin Khan,Krunal Pandya","Quinton de Kock (WK),KL Rahul (UKN),Manan Vohra (UKN),Deepak Hooda (AR),Marcus Stoinis (AR),Evin Lewis (UKN),Krunal Pandya (AR),Dushmantha Chameera (BL),Mohsin Khan (BL),Avesh Khan (BL),Ravi Bishnoi (BL)","Virat Kohli (UKN),Faf du Plessis (UKN),Rajat Patidar (UKN),Glenn Maxwell (AR),Mahipal Lomror (AR),Dinesh Karthik (WK),Shahbaz Ahmed (AR),Harshal Patel (BL),Wanindu Hasaranga de Silva (AR),Josh Hazlewood (BL),Mohammed Siraj (BL)","Rajat Patidar,Dinesh Karthik","Josh Hazlewood,Harshal Patel",25 May 2022 - night match (20-over match),Michael Gough,Jayaraman Madanagopal,Bruce Oxenford,Manu Nayyar,Virender Sharma
2022,1312199,Rajasthan Royals v Royal Challengers Bangalore,RR v RCB,"Qualifier 2 (N), Indian Premier League at Ahmedabad, May 27 2022",RR,RCB,RR,BOWL FIRST,157/8,161/3,161/3,157/8,RR,Royals won by 7 wkts (11b rem),2022-05-27T14:00Z,2022-05-28T23:59Z,57851,"Narendra Modi Stadium, Motera, Ahmedabad",Sanju Samson,Faf du Plessis,Jos Buttler,None,False,18.1,161,3,22,20,157,8,16,"Buttler ton, Prasidh-McCoy show put Royals in IPL final. Royal Challengers Bangalore were restricted to 157 for 8 and then were beaten with 11 balls to spare","Jos Buttler,Sanju Samson","Prasidh Krishna,Obed McCoy","Yashasvi Jaiswal (UKN),Jos Buttler (UKN),Sanju Samson (WK),Devdutt Padikkal (UKN),Shimron Hetmyer (UKN),Riyan Parag (UKN),Ravichandran Ashwin (AR),Trent Boult (BL),Yuzvendra Chahal (BL),Prasidh Krishna (BL),Obed McCoy (BL)","Virat Kohli (UKN),Faf du Plessis (UKN),Rajat Patidar (UKN),Glenn Maxwell (AR),Mahipal Lomror (AR),Dinesh Karthik (WK),Shahbaz Ahmed (AR),Wanindu Hasaranga de Silva (AR),Harshal Patel (BL),Josh Hazlewood (BL),Mohammed Siraj (BL)","Rajat Patidar,Faf du Plessis","Josh Hazlewood,Wanindu Hasaranga de Silva",27 May 2022 - night match (20-over match),Chris Gaffaney,Nitin Menon,Anil Chaudhary,Javagal Srinath,KN Ananthapadmanabhan
2022,1312200,Gujarat Titans v Rajasthan Royals,GT v RR,"Final (N), Indian Premier League at Ahmedabad, May 29 2022",GT,RR,RR,BAT FIRST,130/9,133/3,133/3,130/9,GT,Titans won by 7 wkts (11b rem),2022-05-29T14:30Z,2022-05-30T23:59Z,57851,"Narendra Modi Stadium, Motera, Ahmedabad",Hardik Pandya,Sanju Samson,Hardik Pandya,None,False,18.1,133,3,14,20,130,9,15,All-round Hardik Pandya leads debutants Gujarat Titans to dream title. Captain takes three wickets and scores vital 34 as Titans make light work of Royals' 130,"Shubman Gill,Hardik Pandya","Hardik Pandya,Ravisrinivasan Sai Kishore","Wriddhiman Saha (WK),Shubman Gill (UKN),Matthew Wade (UKN),Hardik Pandya (AR),David Miller (UKN),Rahul Tewatia (AR),Rashid Khan (BL),Ravisrinivasan Sai Kishore (BL),Lockie Ferguson (BL),Yash Dayal (BL),Mohammed Shami (BL)","Yashasvi Jaiswal (UKN),Jos Buttler (UKN),Sanju Samson (WK),Devdutt Padikkal (UKN),Shimron Hetmyer (UKN),Ravichandran Ashwin (AR),Riyan Parag (UKN),Trent Boult (BL),Obed McCoy (BL),Prasidh Krishna (BL),Yuzvendra Chahal (BL)","Jos Buttler,Yashasvi Jaiswal","Trent Boult,Yuzvendra Chahal",29 May 2022 - night match (20-over match),Chris Gaffaney,Nitin Menon,KN Ananthapadmanabhan,Javagal Srinath,Anil Chaudhary
